{
  "protocol":"coordinate-motion-v1",
  "metadata":{"title":"Vertical Short - Bold Hook","version":1,"description":"9:16 short with hook and captions"},
  "composition":{"width":1080,"height":1920,"fps":30,"duration":8,"background":"#0A0A0A"},
  "scenes":[
    {"id":"scene-01","name":"Hook","start":0,"duration":4,"background":"#0A0A0A"},
    {"id":"scene-02","name":"Reveal","start":4,"duration":4,"background":"#FFFFFF"}
  ],
  "tracks":[
    {"id":"track-bg","type":"graphics","name":"BG","enabled":true},
    {"id":"track-title","type":"text","name":"Title","enabled":true},
    {"id":"track-caption","type":"text","name":"Captions","enabled":true}
  ],
  "objects":[
    {"id":"hook","type":"text","trackId":"track-title","start":0.2,"duration":3.5,"properties":{"x":540,"y":800,"content":"STOP\nSCROLLING","fontSize":96,"fontFamily":"Arial Black","fontWeight":900,"fill":"#FFFFFF","align":"center","opacity":1,"scaleX":1,"scaleY":1,"lineHeight":0.9},"keyframes":[{"time":0.2,"properties":{"scaleX":0.4,"scaleY":0.4,"opacity":0},"easing":"easeOutBack"},{"time":0.8,"properties":{"scaleX":1,"scaleY":1,"opacity":1},"easing":"easeOutBack"}]},
    {"id":"subhook","type":"text","trackId":"track-caption","start":0.9,"duration":3,"properties":{"x":540,"y":1120,"content":"This changes everything ↓","fontSize":28,"fontFamily":"Inter, sans-serif","fontWeight":600,"fill":"#00FF88","align":"center","opacity":1},"keyframes":[{"time":0.9,"properties":{"y":1180,"opacity":0},"easing":"easeOutCubic"},{"time":1.4,"properties":{"y":1120,"opacity":1},"easing":"easeOutCubic"}]},
    {"id":"bar","type":"rect","trackId":"track-bg","start":0.5,"duration":3,"properties":{"x":490,"y":1040,"width":100,"height":4,"fill":"#00FF88","opacity":1,"rx":2},"keyframes":[{"time":0.5,"properties":{"width":0},"easing":"easeOutCubic"},{"time":0.9,"properties":{"width":100},"easing":"easeOutCubic"}]},
    {"id":"reveal-bg","type":"rect","trackId":"track-bg","start":4,"duration":4,"properties":{"x":0,"y":0,"width":1080,"height":1920,"fill":"#FFFFFF","opacity":1,"rx":0},"keyframes":[{"time":4,"properties":{"y":1920,"opacity":0},"easing":"easeInOutCubic"},{"time":4.6,"properties":{"y":0,"opacity":1},"easing":"easeInOutCubic"}]},
    {"id":"reveal-title","type":"text","trackId":"track-title","start":4.4,"duration":3.5,"properties":{"x":540,"y":900,"content":"HERE'S\nTHE SECRET","fontSize":88,"fontFamily":"Arial Black","fontWeight":900,"fill":"#0A0A0A","align":"center","opacity":1},"keyframes":[{"time":4.4,"properties":{"scaleX":0.8,"opacity":0},"easing":"easeOutBack"},{"time":5.0,"properties":{"scaleX":1,"opacity":1},"easing":"easeOutBack"}]},
    {"id":"cta","type":"rect","trackId":"track-caption","start":5.2,"duration":2.5,"properties":{"x":340,"y":1200,"width":400,"height":64,"fill":"#0A0A0A","opacity":1,"rx":32},"keyframes":[{"time":5.2,"properties":{"scaleX":0.9,"opacity":0},"easing":"easeOutCubic"},{"time":5.6,"properties":{"scaleX":1,"opacity":1},"easing":"easeOutCubic"}]},
    {"id":"cta-text","type":"text","trackId":"track-caption","start":5.3,"duration":2.5,"properties":{"x":540,"y":1232,"content":"Follow for more","fontSize":20,"fontFamily":"Inter, sans-serif","fontWeight":700,"fill":"#FFFFFF","align":"center","opacity":1},"keyframes":[{"time":5.3,"properties":{"opacity":0},"easing":"linear"},{"time":5.7,"properties":{"opacity":1},"easing":"linear"}]}
  ],
  "exportSettings":{"format":"webm","quality":"high"}
}
